wave,move_group,scope,dependency_evidence,entry_criteria,key_activities,exit_criteria,rollback_owner
0,MG-00 Discovery and decision baseline,"Module 1 and Module 2 evidence, migration pattern decision","docs/01-current-state-assessment.md; docs/02-discovery-findings-summary.md; inventory/dependency_graph.mmd","Baseline app evidence and dependency inventory exist","Review discovery findings; approve migration pattern; confirm open questions","Recommended pattern and ADR log approved",Migration architect
1,MG-01 Build and container readiness,"Spring Boot app, Maven build, package dependencies, container packaging","inventory/app_inventory.json; inventory/app_inventory.csv","Source builds locally; package dependencies known","Create production Dockerfile; define image tagging; define build-time egress; prepare ACR integration","Container image can be built repeatably and scanned",Application lead
2,MG-02 Database readiness,"H2/PostgreSQL/MySQL profiles and database network flows","inventory/database_inventory.csv; inventory/egress_inventory.csv flows F002/F003","Active DB engine confirmed; downtime tolerance identified","Select managed DB target; define schema/data validation; externalize connection strings","Database target decision and validation plan approved",Database owner
3,MG-03 Managed container replatform,"Azure Container Apps target deployment and health endpoint","inventory/migration_decision_matrix.csv; docs/03-migration-pattern-assessment.md","Container image, target IaC and secrets approach ready","Deploy app to Azure Container Apps; configure ingress; configure health checks; connect to target DB","Target endpoint passes smoke tests",Platform owner
4,MG-04 Network and security hardening,"Ingress, egress, DNS, TLS, secrets and unknown flow validation","inventory/ingress_inventory.csv; inventory/egress_inventory.csv; docs/04-assumptions-risk-register.md","App and DB target deployed in non-prod","Validate TCP 8443; validate SMTP-like flow; create egress allowlist; configure DNS/TLS; lock down secrets","Network controls approved and no unresolved P1 dependency blockers",Network/security owner
5,MG-05 Cutover and hypercare,"Production cutover, validation, rollback and monitoring","docs/05-migration-wave-plan.md; future cutover runbook","Smoke tests, rollback plan and owners ready","Freeze writes if needed; switch DNS/config; run smoke tests; monitor health; start hypercare","Cutover signed off and hypercare active",Release manager
